{
  "schemaVersion": 1,
  "problemId": "no-three-in-line-77",
  "subjectTransactionId": "87f78eb20d47a1db7d4ef35702bf00b4af94ad8d",
  "subjectLedgerPosition": 9,
  "claims": [
    {
      "claimKey": "no-three-in-line-77/rct4-154-subclass-encoding-theorem",
      "statement": "Let rho(x,y)=(y,76-x), and define the rct4 subclass of G_77 to consist exactly of sets with empty anti-diagonal, occupied off-diagonal cells equal to unions of complete four-cell rho-orbits, and main-diagonal intersection equal to exactly one antipodal pair. Give each such four-cell orbit and diagonal pair a Boolean variable, require exactly 38 four-orbit variables and one diagonal-pair variable, and for every maximal lattice line L with at least three grid cells require the weighted inequality sum_v |L intersect O_v| y_v at most 2. Expanding a satisfying assignment gives a 154-point no-three-in-line member of the rct4 subclass, and every 154-point no-three-in-line member of that subclass gives exactly one satisfying assignment. This claim makes no assertion about an implementation-specific constraint count or digest, satisfiability or infeasibility, any larger symmetry class, classification of rotations, or the value of D(77).",
      "dependencyTransactionIds": []
    }
  ],
  "dependencyTransactionIds": [],
  "knowledgeContext": null,
  "packetDigest": "sha256:5b64a106d26c0c44ac2a0d5da757fd38f3c1cc322357af29d0823ac144421815"
}
