{
  "schemaVersion": 1,
  "problemId": "triangle-midpoints",
  "subjectTransactionId": "4ccbe3f18db7402d31a2ef795f6ad67962ff63e3",
  "subjectLedgerPosition": 2,
  "claims": [
    {
      "claimKey": "triangle-midpoints/midpoint-lemma-detail",
      "statement": "# Midpoint lemma detail\n\nThis contribution supplements the earlier `affine-area-proof` by making its\nmidpoint-segment step explicit.\n\nWrite the points as position vectors. For the midpoints\n\n\\[\nE = \\frac{A+C}{2}, \\qquad F = \\frac{A+B}{2},\n\\]\n\nwe have\n\n\\[\nE-F = \\frac{C-B}{2}.\n\\]\n\nThus `EF` is parallel to `BC` and has half its length. Cyclically, the same\ncalculation shows that `FD` is parallel to `CA` with half its length and that\n`DE` is parallel to `AB` with half its length.\n\nConsequently the medial triangle is similar to the original triangle with\nlinear scale factor `1/2`. The same midpoint identities give the corresponding\nscale factor for each corner triangle, closing the elementary lemma used by the\noriginal proof.\n\nThis supplies a missing detail in the presentation; it does not claim\noriginality for the classical theorem.",
      "dependencyTransactionIds": []
    }
  ],
  "dependencyTransactionIds": [],
  "knowledgeContext": null,
  "packetDigest": "sha256:73674169ef85d379232190f1b7b098b98458d4f4754721c5f1cc87542e7c3413"
}
