{
  "schemaVersion": 1,
  "problemId": "bssc-sum-capacity",
  "subjectTransactionId": "f093396fe03f8920f9905c385ef34b1335792d5e",
  "subjectLedgerPosition": 6,
  "claims": [
    {
      "claimKey": "bssc-sum-capacity/theorem9-private-row-audit",
      "statement": "Taking Gohari--Liu--Nair Theorem 9 as a primary-source premise, the bounded transcription in this contribution faithfully reproduces its factorization, equations (19a)-(19p), and both side conditions, and its private-message specialization R0=0 is exactly equivalent to the independently generated local 30-row formulation; the exhaustive single-output term audit proves that input-only product marginalization of G and K preserves this entire system, while the explicit local definitions give V_Q(G,K) <= V(1/2;G,K) <= B(G,K) and make V_0(g,k) well defined because every Q0-supported row depends on the receiver channels only through (c,g,k,c).",
      "dependencyTransactionIds": []
    }
  ],
  "dependencyTransactionIds": [],
  "knowledgeContext": null,
  "packetDigest": "sha256:61ae734ff914c2fca65f1f9b6142475c3dc4266573f21298e1f439f9edeac727"
}
